Question,Answer
How can I lose weight fast?,Create a calorie deficit through diet and exercise.
What is the best diet for weight loss?,"A balanced diet with high protein, fiber, and healthy fats."
Can I lose weight without exercise?,"Yes, by controlling calories and eating nutrient-dense foods."
How much water should I drink for weight loss?,Drink at least 8-10 glasses per day.
Does intermittent fasting help with weight loss?,"Yes, it helps with calorie restriction and metabolism."
What are the best exercises for burning fat?,"Cardio, HIIT, and strength training work best."
How many calories should I eat to lose weight?,Reduce 500-1000 calories per day for gradual weight loss.
Can I eat carbs and still lose weight?,"Yes, by choosing complex carbs and maintaining portion control."
What foods should I avoid for weight loss?,"Avoid sugary drinks, processed foods, and refined carbs."
Is keto diet good for weight loss?,"Yes, but it requires strict adherence."
How can I lose belly fat quickly?,Combine exercise with a healthy diet and reduce sugar intake.
What are the best high-protein foods for weight loss?,"Chicken, fish, tofu, lentils, and eggs are great options."
Does drinking green tea help with weight loss?,"Yes, it can boost metabolism and fat burning."
What is the best way to track my weight loss?,Use apps like MyFitnessPal or keep a food journal.
Can I lose weight while eating junk food?,It's possible but not ideal for nutrition.
What is the best diet for PCOS weight loss?,"A low-GI, high-protein, fiber-rich diet is best."
How can I lose weight if I have hypothyroidism?,"Eat iodine-rich foods, avoid processed carbs, and exercise."
Can I lose weight with diabetes?,Manage blood sugar levels with a balanced diet and exercise.
What is the best diet for high blood pressure?,"Reduce salt intake, eat potassium-rich foods."
How can I lose weight with knee pain?,Low-impact exercises and healthy diet changes help.
What diet helps with digestive issues and weight loss?,"Avoid trigger foods, eat fiber-rich meals."
How can I lose weight if I have anemia?,Eat iron-rich foods with vitamin C for better absorption.
Does sleep affect weight loss?,Lack of sleep increases hunger hormones and weight gain.
How can I lose weight with arthritis?,Eat anti-inflammatory foods and do low-impact exercises.
What are the best foods for weight loss after pregnancy?,Eat nutrient-dense foods and healthy snacks.
How can I speed up my metabolism for weight loss?,"Increase protein, eat more frequently, and stay active."
Can I lose weight if I have depression?,"Yes, but requires structured support and motivation."
What are the best low-calorie snacks for weight loss?,"Opt for nuts, fruits, yogurt, or hummus."
Does apple cider vinegar help in weight loss?,"It may help, but it's not a magic solution."
What are the best vegetarian foods for weight loss?,"Lentils, chickpeas, nuts, and soy products are good."
How much protein do I need to lose weight?,0.8-1.2g per kg of body weight is ideal.
Can I drink coffee while trying to lose weight?,"Yes, in moderation without sugar and cream."
What is the best fruit for weight loss?,"Berries, apples, and oranges are great choices."
Can skipping meals help me lose weight?,Skipping meals can slow metabolism and increase cravings.
Does stress cause weight gain?,"Chronic stress increases cortisol, leading to weight gain."
How do I stay motivated to lose weight?,Set small goals and track progress.
Can I lose weight while breastfeeding?,"Yes, but requires extra nutrition and hydration."
What is a good meal plan for weight loss?,"Balanced meals with lean protein, fiber, and healthy fats."
What should I eat before and after workouts?,"Carbs before workouts, protein after workouts."
How does fiber help with weight loss?,Increases satiety and aids digestion.
Can eating late at night cause weight gain?,"Yes, if consuming too many calories late at night."
How can I control hunger while dieting?,"Drink water, eat protein, and include fiber-rich foods."
What is the best time to eat meals for weight loss?,Eat within a 12-hour window and avoid late-night meals.
How do I avoid muscle loss while losing weight?,Maintain protein intake and engage in strength training.
What is the role of strength training in weight loss?,It helps tone and retain muscle mass.
Are weight loss supplements effective?,"Most aren't effective, natural foods are best."
Can hormonal imbalance cause weight gain?,"Yes, especially thyroid and estrogen imbalances."
What are the best foods for fat loss?,"Leafy greens, lean protein, and healthy fats help."
How can I burn more calories throughout the day?,"Increase movement, do more daily activity."
Is yoga good for weight loss?,"Yes, improves flexibility and promotes fat loss."
Does alcohol affect weight loss?,"Yes, it adds empty calories and slows metabolism."
How do I stop cravings for unhealthy foods?,Create a calorie deficit through diet and exercise.
What role does gut health play in weight loss?,"A balanced diet with high protein, fiber, and healthy fats."
What are the best foods for thyroid health and weight loss?,"Yes, by controlling calories and eating nutrient-dense foods."
How can I naturally detox for weight loss?,Drink at least 8-10 glasses per day.
What are the best low-carb foods for weight loss?,"Yes, it helps with calorie restriction and metabolism."
What is the best dairy alternative for weight loss?,"Cardio, HIIT, and strength training work best."
Can I eat chocolate while dieting?,Reduce 500-1000 calories per day for gradual weight loss.
How can I lose weight without feeling hungry?,"Yes, by choosing complex carbs and maintaining portion control."
What is the best morning drink for weight loss?,"Avoid sugary drinks, processed foods, and refined carbs."
How do I prevent loose skin after weight loss?,"Yes, but it requires strict adherence."
What are the best lifestyle changes for weight loss?,Combine exercise with a healthy diet and reduce sugar intake.
How can I lose weight while working a desk job?,"Chicken, fish, tofu, lentils, and eggs are great options."
Can meal prepping help with weight loss?,"Yes, it can boost metabolism and fat burning."
How does walking help with weight loss?,Use apps like MyFitnessPal or keep a food journal.
Is drinking lemon water helpful for weight loss?,It's possible but not ideal for nutrition.
What is the role of gut bacteria in weight loss?,"A low-GI, high-protein, fiber-rich diet is best."
Can I drink milk while dieting?,"Eat iodine-rich foods, avoid processed carbs, and exercise."
What are the best ways to measure weight loss progress?,Manage blood sugar levels with a balanced diet and exercise.
Is snacking good or bad for weight loss?,"Reduce salt intake, eat potassium-rich foods."
How do I break a weight loss plateau?,Low-impact exercises and healthy diet changes help.
"What are the best high-volume, low-calorie foods?","Avoid trigger foods, eat fiber-rich meals."
Can I eat rice and still lose weight?,Eat iron-rich foods with vitamin C for better absorption.
What role does protein play in fat loss?,Lack of sleep increases hunger hormones and weight gain.
Are cheat meals okay during weight loss?,Eat anti-inflammatory foods and do low-impact exercises.
How can I build muscle while losing fat?,Eat nutrient-dense foods and healthy snacks.
Does eating spicy food help burn fat?,"Increase protein, eat more frequently, and stay active."
What is the best way to lose weight after 40?,"Yes, but requires structured support and motivation."
How does hydration impact fat loss?,"Opt for nuts, fruits, yogurt, or hummus."
Are smoothies good for weight loss?,"It may help, but it's not a magic solution."
Can I lose weight while eating dairy?,"Lentils, chickpeas, nuts, and soy products are good."
How do I improve my digestion for weight loss?,0.8-1.2g per kg of body weight is ideal.
Can probiotic foods help with weight loss?,"Yes, in moderation without sugar and cream."
What is the best way to reduce sugar cravings?,"Berries, apples, and oranges are great choices."
How does insulin resistance affect weight loss?,Skipping meals can slow metabolism and increase cravings.
What are the best anti-inflammatory foods for weight loss?,"Chronic stress increases cortisol, leading to weight gain."
How do I make weight loss sustainable?,Set small goals and track progress.
Can fasting too much slow down metabolism?,"Yes, but requires extra nutrition and hydration."
Does cardio or weightlifting burn more fat?,"Balanced meals with lean protein, fiber, and healthy fats."
What are the best foods to eat before bed for fat loss?,"Carbs before workouts, protein after workouts."
Can I eat peanut butter while dieting?,Increases satiety and aids digestion.
Does lifting weights make women bulky?,"Yes, if consuming too many calories late at night."
How can I lose fat without losing strength?,"Drink water, eat protein, and include fiber-rich foods."
Are artificial sweeteners bad for weight loss?,Eat within a 12-hour window and avoid late-night meals.
What is the best way to recover from binge eating?,Maintain protein intake and engage in strength training.
How does portion control help with weight loss?,It helps tone and retain muscle mass.
How can I lose weight fast?,"Most aren't effective, natural foods are best."
What is the best diet for weight loss?,"Yes, especially thyroid and estrogen imbalances."
Can I lose weight without exercise?,"Leafy greens, lean protein, and healthy fats help."
How much water should I drink for weight loss?,"Increase movement, do more daily activity."
I have PCOS. How can I lose weight?,"PCOS can make weight loss challenging. Try a low-carb, high-protein diet, include strength training, and manage stress. Regular exercise and avoiding processed foods help balance hormones."
I have hypothyroidism. Why is it hard for me to lose weight?,"Hypothyroidism slows metabolism, making weight loss difficult. Eating iodine-rich foods, exercising regularly, and taking prescribed thyroid medication can help."
Can I lose weight if I have diabetes?,"Yes! Focus on low-carb meals, fiber-rich foods, and regular exercise to stabilize blood sugar and lose weight safely."
I have high blood pressure. What’s the best way to lose weight?,"Focus on low-sodium, heart-healthy foods, and engage in light cardio like walking, cycling, or swimming to improve heart health."
How can I lose weight if I have knee pain?,"Try low-impact exercises like swimming, cycling, or seated strength training to avoid stressing your knees."
I have an eating disorder history. How can I lose weight healthily?,"Focus on balanced nutrition, mindful eating, and consult a nutritionist to develop a safe and sustainable plan."
I suffer from chronic fatigue. How can I exercise for weight loss?,Start with light activities like yoga or walking and gradually increase intensity as your energy levels improve.
I have asthma. Can I do cardio for weight loss?,Yes! Try low-impact cardio like swimming or cycling and use your inhaler before workouts if needed.
Can I lose weight after pregnancy?,"Yes, but go slow. Start with postnatal-friendly exercises like walking, pelvic floor exercises, and light strength training."
I have digestive issues. What’s the best diet for weight loss?,"Eat fiber-rich foods, probiotics, and avoid processed foods to support digestion and weight loss."
I have anemia. How can I lose weight without feeling weak?,"Focus on iron-rich foods like spinach, lentils, and lean meats and stay hydrated while maintaining a balanced diet."
I have insomnia. Can poor sleep affect weight loss?,"Yes! Poor sleep disrupts hormones that control hunger. Try improving sleep hygiene, reducing screen time, and managing stress for better weight management."
I have arthritis. What’s the best way to lose weight?,"Focus on low-impact activities like swimming, cycling, and chair exercises to reduce joint strain."
I have depression. How can I stay motivated to lose weight?,"Start with small, enjoyable activities like walking or dancing, and seek support from friends, family, or professionals."
I have PCOS and keep gaining weight despite exercising. What should I do?,"PCOS can cause insulin resistance. Focus on a low-GI diet, strength training, and stress management to control weight gain."
I have heart problems. How can I exercise safely for weight loss?,Stick to light cardio like walking or swimming and consult your doctor before starting any workout routine.
I have acid reflux. What foods should I avoid while trying to lose weight?,"Avoid spicy foods, citrus, caffeine, and fried foods, and eat smaller meals to prevent acid reflux."
I have a slow metabolism. How can I speed it up for weight loss?,"Strength training, protein-rich foods, drinking water, and getting enough sleep help boost metabolism."
I have high cholesterol. What’s the best way to lose weight?,"Focus on fiber-rich foods, healthy fats, and regular exercise to improve cholesterol levels while losing weight."
I am on medication that causes weight gain. How can I manage my weight?,"Stay active, eat a balanced diet, and talk to your doctor about alternative medications or dietary adjustments."
What’s the best workout for beginners?,"A mix of bodyweight exercises like squats, lunges, push-ups, and planks is great for beginners."
How many times a week should I work out?,"3-5 days a week, depending on your fitness goals."
What is the best time to work out?,"Any time that fits your schedule, but mornings can boost metabolism."
Should I do cardio before or after weights?,"Strength training first, then cardio, for better muscle preservation."
What is HIIT?,HIIT (High-Intensity Interval Training) involves short bursts of intense exercise followed by rest periods
How long should my workouts be?,30-60 minutes is ideal for most workouts.
Can I work out every day?,"Yes, but include rest or active recovery days to prevent injuries."
How can I stay consistent with my workouts?,"Set goals, track progress, and find an exercise routine you enjoy."
Do home workouts work?,Yes! Bodyweight exercises and resistance bands can be effective.
How can I increase my stamina?,"21. Regular cardio workouts, proper breathing, and hydration help improve stamina."
